{
 "orvane": "0.1",
 "monde": "sv-1",
 "instantane": 0,
 "periode": {
  "debut": "2026-10-26T03:00:00Z",
  "fin": "2026-10-27T03:00:00Z"
 },
 "source": {
  "jeu": "stone-valley",
  "compte": "h:b2",
  "zone": "ile:2"
 },
 "evenements": [
  {
   "taxon": "brouteur",
   "biome": "prairie",
   "action": "rencontre",
   "n": 25
  },
  {
   "taxon": "brouteur",
   "phenotype": "base",
   "biome": "prairie",
   "action": "prelevement",
   "n": 6
  },
  {
   "taxon": "brouteur",
   "phenotype": "albinisme",
   "biome": "prairie",
   "action": "capture",
   "n": 1
  }
 ]
}